{
 "active_requests": 1,
 "cyclic": true,
 "device": 0,
 "device_name": "NVIDIA GeForce RTX 5090",
 "events": [
  {
   "kernel_id": 1,
   "name": "",
   "order": 0,
   "stream": 0,
   "tensors": [
    {
     "access": "read_write",
     "id": 577
    },
    {
     "access": "read_write",
     "id": 578
    },
    {
     "access": "read",
     "id": 579
    }
   ]
  },
  {
   "kernel_id": 2,
   "name": "",
   "order": 1,
   "stream": 0,
   "tensors": [
    {
     "access": "read_write",
     "id": 580
    },
    {
     "access": "read_write",
     "id": 581
    },
    {
     "access": "read",
     "id": 582
    }
   ]
  },
  {
   "kernel_id": 3,
   "name": "",
   "order": 2,
   "stream": 0,
   "tensors": [
    {
     "access": "read_write",
     "id": 583
    },
    {
     "access": "read_write",
     "id": 584
    },
    {
     "access": "read",
     "id": 585
    }
   ]
  },
  {
   "kernel_id": 4,
   "name": "",
   "order": 3,
   "stream": 0,
   "tensors": [
    {
     "access": "read",
     "id": 586
    },
    {
     "access": "read",
     "id": 587
    },
    {
     "access": "read",
     "id": 588
    }
   ]
  },
  {
   "kernel_id": 5,
   "name": "",
   "order": 4,
   "stream": 0,
   "tensors": [
    {
     "access": "read_write",
     "id": 589
    },
    {
     "access": "read_write",
     "id": 590
    },
    {
     "access": "read",
     "id": 591
    }
   ]
  },
  {
   "kernel_id": 6,
   "name": "",
   "order": 5,
   "stream": 0,
   "tensors": [
    {
     "access": "read_write",
     "id": 592
    },
    {
     "access": "read_write",
     "id": 593
    },
    {
     "access": "read",
     "id": 594
    }
   ]
  },
  {
   "kernel_id": 7,
   "name": "",
   "order": 6,
   "stream": 0,
   "tensors": [
    {
     "access": "read_write",
     "id": 595
    },
    {
     "access": "read_write",
     "id": 596
    },
    {
     "access": "read",
     "id": 597
    }
   ]
  },
  {
   "kernel_id": 8,
   "name": "",
   "order": 7,
   "stream": 0,
   "tensors": [
    {
     "access": "read",
     "id": 598
    },
    {
     "access": "read",
     "id": 599
    },
    {
     "access": "read",
     "id": 600
    }
   ]
  },
  {
   "kernel_id": 9,
   "name": "",
   "order": 8,
   "stream": 0,
   "tensors": [
    {
     "access": "read_write",
     "id": 601
    },
    {
     "access": "read_write",
     "id": 602
    },
    {
     "access": "read",
     "id": 603
    }
   ]
  },
  {
   "kernel_id": 10,
   "name": "",
   "order": 9,
   "stream": 0,
   "tensors": [
    {
     "access": "read_write",
     "id": 604
    },
    {
     "access": "read_write",
     "id": 605
    },
    {
     "access": "read",
     "id": 606
    }
   ]
  },
  {
   "kernel_id": 11,
   "name": "",
   "order": 10,
   "stream": 0,
   "tensors": [
    {
     "access": "read_write",
     "id": 607
    },
    {
     "access": "read_write",
     "id": 608
    },
    {
     "access": "read",
     "id": 609
    }
   ]
  },
  {
   "kernel_id": 12,
   "name": "",
   "order": 11,
   "stream": 0,
   "tensors": [
    {
     "access": "read",
     "id": 610
    },
    {
     "access": "read",
     "id": 611
    },
    {
     "access": "read",
     "id": 612
    }
   ]
  },
  {
   "kernel_id": 13,
   "name": "",
   "order": 12,
   "stream": 0,
   "tensors": [
    {
     "access": "read_write",
     "id": 613
    },
    {
     "access": "read_write",
     "id": 614
    },
    {
     "access": "read",
     "id": 615
    }
   ]
  },
  {
   "kernel_id": 14,
   "name": "",
   "order": 13,
   "stream": 0,
   "tensors": [
    {
     "access": "read_write",
     "id": 616
    },
    {
     "access": "read_write",
     "id": 617
    },
    {
     "access": "read",
     "id": 618
    }
   ]
  },
  {
   "kernel_id": 15,
   "name": "",
   "order": 14,
   "stream": 0,
   "tensors": [
    {
     "access": "read_write",
     "id": 619
    },
    {
     "access": "read_write",
     "id": 620
    },
    {
     "access": "read",
     "id": 621
    }
   ]
  },
  {
   "kernel_id": 16,
   "name": "",
   "order": 15,
   "stream": 0,
   "tensors": [
    {
     "access": "read",
     "id": 622
    },
    {
     "access": "read",
     "id": 623
    },
    {
     "access": "read",
     "id": 624
    }
   ]
  },
  {
   "kernel_id": 17,
   "name": "",
   "order": 16,
   "stream": 0,
   "tensors": [
    {
     "access": "read_write",
     "id": 625
    },
    {
     "access": "read_write",
     "id": 626
    },
    {
     "access": "read",
     "id": 627
    }
   ]
  },
  {
   "kernel_id": 18,
   "name": "",
   "order": 17,
   "stream": 0,
   "tensors": [
    {
     "access": "read_write",
     "id": 628
    },
    {
     "access": "read_write",
     "id": 629
    },
    {
     "access": "read",
     "id": 630
    }
   ]
  },
  {
   "kernel_id": 19,
   "name": "",
   "order": 18,
   "stream": 0,
   "tensors": [
    {
     "access": "read_write",
     "id": 631
    },
    {
     "access": "read_write",
     "id": 632
    },
    {
     "access": "read",
     "id": 633
    }
   ]
  },
  {
   "kernel_id": 20,
   "name": "",
   "order": 19,
   "stream": 0,
   "tensors": [
    {
     "access": "read",
     "id": 634
    },
    {
     "access": "read",
     "id": 635
    },
    {
     "access": "read",
     "id": 636
    }
   ]
  },
  {
   "kernel_id": 21,
   "name": "",
   "order": 20,
   "stream": 0,
   "tensors": [
    {
     "access": "read_write",
     "id": 637
    },
    {
     "access": "read_write",
     "id": 638
    },
    {
     "access": "read",
     "id": 639
    }
   ]
  },
  {
   "kernel_id": 22,
   "name": "",
   "order": 21,
   "stream": 0,
   "tensors": [
    {
     "access": "read_write",
     "id": 640
    },
    {
     "access": "read_write",
     "id": 641
    },
    {
     "access": "read",
     "id": 642
    }
   ]
  },
  {
   "kernel_id": 23,
   "name": "",
   "order": 22,
   "stream": 0,
   "tensors": [
    {
     "access": "read_write",
     "id": 643
    },
    {
     "access": "read_write",
     "id": 644
    },
    {
     "access": "read",
     "id": 645
    }
   ]
  },
  {
   "kernel_id": 24,
   "name": "",
   "order": 23,
   "stream": 0,
   "tensors": [
    {
     "access": "read",
     "id": 646
    },
    {
     "access": "read",
     "id": 647
    },
    {
     "access": "read",
     "id": 648
    }
   ]
  },
  {
   "kernel_id": 25,
   "name": "",
   "order": 24,
   "stream": 0,
   "tensors": [
    {
     "access": "read_write",
     "id": 649
    },
    {
     "access": "read_write",
     "id": 650
    },
    {
     "access": "read",
     "id": 651
    }
   ]
  },
  {
   "kernel_id": 26,
   "name": "",
   "order": 25,
   "stream": 0,
   "tensors": [
    {
     "access": "read_write",
     "id": 652
    },
    {
     "access": "read_write",
     "id": 653
    },
    {
     "access": "read",
     "id": 654
    }
   ]
  },
  {
   "kernel_id": 27,
   "name": "",
   "order": 26,
   "stream": 0,
   "tensors": [
    {
     "access": "read_write",
     "id": 655
    },
    {
     "access": "read_write",
     "id": 656
    },
    {
     "access": "read",
     "id": 657
    }
   ]
  },
  {
   "kernel_id": 28,
   "name": "",
   "order": 27,
   "stream": 0,
   "tensors": [
    {
     "access": "read",
     "id": 658
    },
    {
     "access": "read",
     "id": 659
    },
    {
     "access": "read",
     "id": 660
    }
   ]
  },
  {
   "kernel_id": 29,
   "name": "",
   "order": 28,
   "stream": 0,
   "tensors": [
    {
     "access": "read_write",
     "id": 661
    },
    {
     "access": "read_write",
     "id": 662
    },
    {
     "access": "read",
     "id": 663
    }
   ]
  },
  {
   "kernel_id": 30,
   "name": "",
   "order": 29,
   "stream": 0,
   "tensors": [
    {
     "access": "read_write",
     "id": 664
    },
    {
     "access": "read_write",
     "id": 665
    },
    {
     "access": "read",
     "id": 666
    }
   ]
  },
  {
   "kernel_id": 31,
   "name": "",
   "order": 30,
   "stream": 0,
   "tensors": [
    {
     "access": "read_write",
     "id": 667
    },
    {
     "access": "read_write",
     "id": 668
    },
    {
     "access": "read",
     "id": 669
    }
   ]
  },
  {
   "kernel_id": 32,
   "name": "",
   "order": 31,
   "stream": 0,
   "tensors": [
    {
     "access": "read",
     "id": 670
    },
    {
     "access": "read",
     "id": 671
    },
    {
     "access": "read",
     "id": 672
    }
   ]
  },
  {
   "kernel_id": 33,
   "name": "",
   "order": 32,
   "stream": 0,
   "tensors": [
    {
     "access": "read_write",
     "id": 673
    },
    {
     "access": "read_write",
     "id": 674
    },
    {
     "access": "read",
     "id": 675
    }
   ]
  },
  {
   "kernel_id": 34,
   "name": "",
   "order": 33,
   "stream": 0,
   "tensors": [
    {
     "access": "read_write",
     "id": 676
    },
    {
     "access": "read_write",
     "id": 677
    },
    {
     "access": "read",
     "id": 678
    }
   ]
  },
  {
   "kernel_id": 35,
   "name": "",
   "order": 34,
   "stream": 0,
   "tensors": [
    {
     "access": "read_write",
     "id": 679
    },
    {
     "access": "read_write",
     "id": 680
    },
    {
     "access": "read",
     "id": 681
    }
   ]
  },
  {
   "kernel_id": 36,
   "name": "",
   "order": 35,
   "stream": 0,
   "tensors": [
    {
     "access": "read",
     "id": 682
    },
    {
     "access": "read",
     "id": 683
    },
    {
     "access": "read",
     "id": 684
    }
   ]
  },
  {
   "kernel_id": 37,
   "name": "",
   "order": 36,
   "stream": 0,
   "tensors": [
    {
     "access": "read_write",
     "id": 685
    },
    {
     "access": "read_write",
     "id": 686
    },
    {
     "access": "read",
     "id": 687
    }
   ]
  },
  {
   "kernel_id": 38,
   "name": "",
   "order": 37,
   "stream": 0,
   "tensors": [
    {
     "access": "read_write",
     "id": 688
    },
    {
     "access": "read_write",
     "id": 689
    },
    {
     "access": "read",
     "id": 690
    }
   ]
  },
  {
   "kernel_id": 39,
   "name": "",
   "order": 38,
   "stream": 0,
   "tensors": [
    {